RG,SG,Series,Barcode,Date,Caption,General Description,Item,Ordered By,Owber,Colored,Height,Width,Pub/Printer,Condition
9026,000,001,508339,06/10/1944,House at the Crossroads,"WWII; Normandy, France; shows route the battalion followed south, body of 1st Lieutenant Edward B. Tucker being decorated by two French ladies",,,,FALSE,14,17.75,"62nd Engineer, top Co U. S. Army",Marks from framing tape
9026,000,001,508339,1944,Group of Bodies,"WWII; Normandy, France; series of dead bodies, the leading body being Lieutenant Colonel William E. Warfield",,,,FALSE,14,17.75,"62nd Engineer, top Co U. S. Army",Marks from framing tape
9026,000,001,508339,1944,Scene in the Road,"WWII; Normandy, France; about 100 yards to the south from the crossroads.  Two self-propelled German guns, group of American and German dead, Hill 192 in the background",,,,FALSE,14,17.75,"62nd Engineer, top Co U. S. Army",Marks from framing tape
9026,000,001,508340,10/05/1926,Military Order of the Loyal Legion of the United States,Captain Thomas Grier Murphy died in the Civil War and his son Sanford Sayie Murphy was elected a hereditary companion of the Order,,,,FALSE,18,23,,Good
9026,000,001,508340,12/15/1864,The United States Volunteer Service,The President Abraham Lincoln's thanks to private Taylor Allee for 100 days of volunteer service,,,,FALSE,13,15,,Discoloration
9026,000,001,508340,,Delaware Indians Acting as Scouts for the Federal Army in the West,"from Harper's and Leslie's Magazine article ""The Soldier in Our Civil War""",,,,FALSE,11,16.5,,Tears on edges
9026,000,001,508340,,Battle of Bull Run,Print from Fort Delaware Society by Currier and Ives (3 of 3),,,,TRUE,20,27.5,,Frame damaged
9026,000,001,508340,,Capture of Fort Fisher,Print from Fort Delaware Society by Currier and Ives (2 of 3),,,,TRUE,22,29.5,,Frame damaged
9026,000,001,508340,,Storming Fort Wagner,Print from Fort Delaware Society by Currier and Ives (1 of 3),,,,TRUE,22,28,,Frame damaged
9026,000,001,508340,1884,The Three Cardinal Principles of the Grand Army of the Republic,Fraternity - Loyalty - Charity,,,,TRUE,29,21.5,"A. C. Leonard, Lancaster, PA","In Mylar, lots of tears"
9026,000,001,508340,06/15/1906,To all Whom it may Concern Know Ye that Warren Harrington,An Honorable discharge from the Union Army,,,,TRUE,30,22,"The Easel Monument Association, Chicago, Illinois",Some discoloration and tears
9026,000,001,508340,06/15/1897,To all Whom it may Concern Know Ye that James Maull,Civil War soldier's memorial listing the battles he participated in.,,,,TRUE,30,21.5,"The Easel Monument Association, Chicago, Illinois",Some damage to edges
9026,000,001,508340,12/15/1897,To all Whom it may Concern Know Ye that William Castelow,Civil War soldier's memorial listing the battles he participated in.,,,,TRUE,,,"The Easel Monument Association, Chicago, Illinois",Good
9026,000,001,508340,09/15/1897,To all Whom it may Concern Know Ye that John W. Dyer,Civil War soldier's memorial listing the battles he participated in.,,,,TRUE,28,19.75,"The Easel Monument Association, Chicago, Illinois","Border cut off, some water damage"
9026,000,001,508340,12/15/1880,To all Whom it may Concern Know Ye that Captain Evan S. Watson,An Honorable discharge from the Union Army,,,,TRUE,30,22,"The Easel Monument Association, Chicago, Illinois",Large horizontal tears
9026,000,001,508340,12/15/1897,To all Whom it may Concern Know Ye that Samuel P. Roberts,Civil War soldier's memorial listing the battles he participated in.,,,,TRUE,29.5,22,"The Easel Monument Association, Chicago, Illinois",Ripped into 6 pieces
9026,000,001,508340,06/15/1897,To all Whom it may Concern Know Ye that Gilley K. Swain,Civil War soldier's memorial listing the battles he participated in.,,,,TRUE,29.5,21.5,"The Easel Monument Association, Chicago, Illinois",Torn in half
9026,000,001,508340,1865,Army of the Potomac,"Lists positions, principle battles and losses, field of operations, includes illustrations and photos of leaders",,,,TRUE,25,19,,Has tissue paper lamination
9026,000,001,508340,1963,Soldier's Memorial,"Company B, 4th Regiment, Delaware Infantry lists positions and memorandum, includes illustrations",,,,TRUE,21.5,18,,"Discolored, some tears"
9026,000,001,508340,1863,Soldier's Memorial,"Company A, 4th Regiment, Delaware Infantry lists positions and memorandum, includes illustrations",,,,TRUE,22,18,"Ehrgott, Forbriger and Co Lithographers",Good except damage to edges
9026,000,001,508340,1864,Soldier's Memorial,"Company F, 1st Delaware Vet, Vol. Infantry lists positions and memorandum, includes illustrations",,,,TRUE,22,18,V. C. Fuller and Co Baltimore,Rather faded
9026,000,001,508340,1863,United States Military Record,"Company A, 1st Battalion, Delaware Volunteer Cavalry, lists Titles and memorandum, includes illustrations",,,,TRUE,23.5,18,G. Sander and Co Print Baltimore,Lots of tears and discoloration
9026,000,001,508340,1862,The Soldier's Memorial,"Company I, 3rd Regiment, Delaware Volunteers, lists Positions of Men and Their Engagements, includes illustrations",,,,TRUE,18.5,15,Currier and Ives,Dark from damage
9026,000,001,508340,1960,The Blue and The Grey 1861,"A collection of four reproduced woodcuts from the illustrator Tom Mast's work on the Civil War for ""Harpers Weekly,"" reprinted and distributed by the Curtis Paper Company, decorative folder gives history behind the prints",,,,FALSE,13,19,"Curtis Paper Company, Newark DE",Good
9026,000,001,508343,,"Liliaceae, Lilium tigrinum Splenders",Picture of 2 orange flowers with black spots,,,,TRUE,14,10,,Good
9026,000,001,508343,,"Liliaceae Single, Indus Triumph Tulip",Picture of a reddish - pink flower,,,,TRUE,14,10,,Good
9026,000,001,508343,,Camellia King Rosea,Picture of a pink flower,,,,TRUE,12.25,9.25,,Good
9026,000,001,508343,,Mallard Duck,Picture of multiple ducks in and around a pond,,,,TRUE,12.25,9.25,Selmar Hess New York,Good
9026,000,001,508343,,Baltimore Oriole,3 birds building a nest with a riverboat in the background on river,,,,TRUE,12.25,9.25,Selmar Hess New York,Good
9026,000,001,508343,,Woodcock,Picture of 2 woodcocks in the woods,,,,TRUE,12.25,9.25,Selmar Hess New York,Good
9026,000,001,508343,,,"3 Pieces, probably taken from a book, depicting different types of birds living by water",,,,TRUE,14.25,11.25,,"Good, except marks form being taken from a book"
9026,000,001,508343,,,"4 pages, probably taken from a book, illustrating various moths, caterpillars, and butterflies",,,,TRUE,10.5,8,,"Good, in Mylar"
9026,000,001,508343,1938,The largest tree in Delaware,"An original work by ""Leach"", shows large tree with small person beneath it",,,,FALSE,11,14.5,,Some damages to edges
9026,000,001,508343,1964,Robert Furber's Twelve Months of Flowers 1730,"Reproduction of Furber's original prints from 1730 that were used to advertise his seed catalogues, 12 prints plus introduction",,,,TRUE,21,15.5,Penn Prints New York,"Excellent, in original packaging"
9026,000,001,508343,1879,The Wreath of Flowers of 1879,A non professional illustration of a wreath of flowers flanked by doves,,,,TRUE,15.25,11.5,,Some small tears
1540,000,179,508346,1939,"The Flag of the State of Delaware, The Blue Hen's Fighting Cock",Courtesy of the Delaware State Highway Department (2 Copies),,,,TRUE,19,12.5,,Damage from tears and fading
1302,002,044,508347,1977,Blue Hen,"A registered lithograph from the famous Richard Sloan Collector Series of Wild Life Paintings, includes brief history of the State Bird, signed by artist and Governor of Delaware.  Blue Hen.",,,,TRUE,22,28,J. L. Wade,"Good, in original packaging"
9026,000,001,508343,03/06/1860,Explosion of a Steamer on the Delaware,picture of a steamer exploding with people and goods flying about,,,,FALSE,11.25,7,,cut from larger page
9026,000,001,508343,02/03/1877,Breaking the Ice Blockade in the Delaware River,A series of ships trying to get through the ice as bystanders watch on ice (2 copies and article on back),,,,FALSE,16,10.75,Harper's Weekly,Poor
9026,000,001,508343,02/12/1887,Ice on the Delaware,Picture of three ships trying to push through the ice,,,,FALSE,11,15.75,Harper's Weekly,Good
9026,000,001,508343,03/31/1888,"Wrecks After the Great Blizzard in Lewes Harbor, Delaware",Shaws sketches and photographs of many ships after the blizzard (2 Copies) and accompanying article,,,,FALSE,16.5,11.25,Harper's Weekly,"One copy is damaged at the edges, the other is torn in half and in Mylar"
9026,000,001,508343,06/02/1877,The Departure of General Grant for Europe - The Parting in Delaware Bay,Crowds in smaller ships surround a large vessel (The Indiana) from which General Grant waves good bye,,,,FALSE,15.25,10.5,Harper's Weekly,"Some spotting, in Mylar"
9026,000,001,508343,,Kalmar Nyckel 1638 - 1938,"Silhouette of the Ship, signed by artist Henry Lau",,,,FALSE,14,11,,Some spotting
9026,000,001,508343,09/29/1877,"""Croker"" Fishing in the Delaware","Picture of men fishing with nets, has caption describing the scene",,,,FALSE,8,11,Harper's Weekly,Original page cut in half
9026,000,001,508343,04/19/1860,"""Shad"" fishing on the Delaware","Sketches of men net fishing, small article on back",,,,FALSE,11,16.5,Harper's Weekly,Some small tears
9026,000,001,508343,07/05/1856,State of Delaware,"A picture of three men in a boat duck hunting, small article above (3 copies, one has been colored by hand)",,,,FALSE,15,11,Ballov's Pictorial,Fair
9026,000,001,508343,03/11/1882,Duck - Shooting Near the Capes of Delaware,"Various scenes with captions describing duck hunting, article on the back",,,,FALSE,16,10.5,Harper's Weekly,a few small tears
9026,000,001,508343,,Fresh Tomatoes Put Up by Samuel Townsend,Picture of three tomatoes,,,,TRUE,6.5,4.5,Ham's Printer 4th and vine Philadelphia,"Good, probably taken from a can"
9026,000,001,508343,,"Samuel Townsend's Celebrated Canned Peaches Put up by Him Fresh From His Orchards at Townsend, Delaware",Picture of a Peach,,,,TRUE,7,4.75,,Some small tears and fading
9026,000,001,508343,,Fresh Tomatoes,Picture of a single Tomato.  Canning label.,,,,TRUE,4.25,13,,Some small tears from when removed from Can
9026,000,001,508343,04/14/1878,Picking Peaches in Delaware,A sketch of 14 people picking peaches,,,,FALSE,11.25,15.75,Harper's Weekly,"Fair, in Mylar"
9026,000,001,508343,09/04/1874,"Peaches and Pickers, The Peach Season in Delaware",Shows various stages from picking peaches to the purchase of peaches,,,,FALSE,20.5,14,The Daily Graphic,Lots of wrinkles and small tears
9026,000,001,508343,1775,Cluer Wall or Clearwell,Picture of estates in Europe,,,,FALSE,8,11,,Fair
9026,000,001,508343,,E Pluribus Unum,"Picture of the American Eagle from the center of the Great Seal, signed by artist with notes in French on back",,,,FALSE,14,10.5,,Good
9026,000,001,508343,,Silent Night,"Picture of a small town in the distance, all is covered with snow",,,,FALSE,11.5,15,,"Curling on edges, discoloration"
9026,000,001,508343,,,Woman in a chair looking at young child hiding behind a curtain,,,,FALSE,10.5,13.75,,Good
9026,000,001,508343,1730-36,The Going Out in the Morning,Sheet music from George Bickham. The Musical Entertainer London,,,,TRUE,17,11,,Good
9026,000,001,508343,1730-36,On Gallant Moor at Moor Hall,Sheet music from George Bickham. The Musical Entertainer London,,,,TRUE,17,11,,Good
9026,000,001,508343,,"Depart Pour Le Labat, call writing in French",Scene in a witch's home filled with goblins with another witch teaching a young maiden to fly on a broom,,,,FALSE,18,14.5,,Edges very damaged with a lot of discoloration
9026,000,001,508343,,Arrive'e Au Sabat,"2 witches surrounded by a variety of monsters, one digging a hole and the other carrying fire",,,,FALSE,17.5,14.5,,Lots of damage to edges and spotting
9026,000,001,508343,09/22/1894,The Whipping Post in Delaware - Scenes at the Autumnal Whipping for 1894 in New Castle,Features 6 photographs with captions describing the days' events,,,,FALSE,16,11,Leslie's Weekly,Good
9026,000,001,508343,11/18/1876,The Whipping Post and Pillory in Delaware,"A sketch of Georgetown whipping post and pillory, includes a description on the back of persons in the sketch",,,,FALSE,16,10.5,Harper's Weekly,Good
9026,000,001,508343,12/12/1868,"The Whipping Post and Pillory at New Castle, Delaware",Picture of crowd gathered around man being whipped at whipping post with another man in the pillory,,,,FALSE,16,10.75,Harper's Weekly,Some damage to edges
9026,000,001,508343,08/26/1882,"Delaware A ""Relic of Barbarism"" which the State Refuses to Abandon - The Whipping Post at New Castle",Sketch of a man being whipped with two men in the pillories while a crowd watches (2 copies plus page with sketch description,,,,FALSE,16,22,Frank Leslie's Illustrated News Paper,Fair in Mylar
9026,000,001,508349,1989,"Legislative Hall, Dover",Print of Legislative Hall,,,,TRUE,15,23.5,,Excellent
9026,000,001,508349,c 1932,Sketch of Legislative Hall,,,,,TRUE,25.5,34,,Some damage but have been conserved
9026,000,001,508344,c 1802,George Washington,"Black and white sketch of George Washington by Denis A. Volazan, the complete portrait rests in the Old State House",,,,FALSE,32.75,23.75,,"Some scratches and markings, damage to the gold foil trim, matte appears to have been trimmed"
9026,000,001,471809,1996,Woodburn,"Picture of Woodburn, Governor's Mansion with 8 former Governors' Signatures (2 Copies)",,,,TRUE,25,30.5,Woodburn Foundation Committee,Excellent
9026,000,001,481745,1893,"Delaware State Building World's Columbian Exposition, Chicago 1893",Picture of the building with patrons on the grounds,,,,TRUE,23,34,Chicago Fine Art Co,Some damage to edges
9026,000,001,508341,,Unidentified School Building,,,,,TRUE,20.5,29.25,,Some damage to edges
9026,000,001,508341,,,"Work by Robert Shaw, two children walking a path in a forest",,,,FALSE,29.5,22.25,,"Edges curling, lots of foxing damage"
9026,000,001,508341,,Nostalgic Summer by Eric Sloane,Picture of children walking by a large red covered bridge (2 Copies),,,,TRUE,14,25.25,,Good
9026,000,001,508341,,Summer Retreat by Ellis Smith,"Picture of a cabin in the woods, signed by Ellis Smith",,,,TRUE,20,24,E. M. M.,Good
9026,000,001,508341,1869,Second Snow by Ellis Smith,Picture of man walking up to a brick house in the snow,,,,TRUE,17,26,,Good
9026,000,001,508341,,Autumn in Old Williamsburg,"Reproduction of Original watercolor by Milton Hull, depicts large home with  people arriving in carriages (2 Copies)",,,,TRUE,17.5,22.5,"The Baughman Company, Richmond Virginia",Good
9026,000,001,508341,,,Portrait of George P. Fisher,,,,FALSE,12,9.5,,Foxing of edges
9026,000,001,508341,,Portrait of Governor Richard C McMullen with brief biographical sketch,,,,,FALSE,14,11,,Foxing of edges
9026,000,001,508341,,,Portrait of Dr. Henry Ridgley,,,,FALSE,12,9.5,,Foxing Spots
9026,000,001,508341,,Thomas Sackill Earl of Dorset,"Baron of Buckhurst, Lord High Treasurer of England, Chancellor of University of Oxford and Knight of the mast noble order of the garte",,,,FALSE,15,9.5,,Good
9026,000,001,508341,,Willard Saulsbury,,,,,FALSE,12,9.5,Engraving by G. Bather and Son Bklyn NY,Good
9026,000,001,508341,,Picture of Thomas F. Bayard looking to his left,,,,,FALSE,25,18.5,"S. Stokes and D. Lothrop Photographers, Philadelphia; Lithograph by O. Schnabel","Poor, strengthened by tissue paper lamination"
9026,000,001,508341,,"Lap-Pa-Win-Soe, a Delaware Chief",A Native American Chief in traditional dress,,,,TRUE,20.75,15,,Damage from being framed
9026,000,001,508341,,King Charles the 2nd Landing on the Beach at Dover,King Charles Greeting a large crowd gathered on the beach to meet him,,,,FALSE,13.5,17.25,"B. West, historical Painter","Good, in Mylar"
9026,000,001,508341,,"Picture of a man and a cat, gift of Ellis Smith the Artist in 1971",,,,,FALSE,20,16,,Good
9026,000,001,508341,,,"Picture of Lord Delaware, Thomas West",,,,FALSE,23,18.5,,Remnants from old frame have caused damage
9026,000,001,508341,,"William Penn, 1682",From the original picture painted for the Society for Commemoration the landing of William Penn on the shores of the Delaware October 1682,,,,FALSE,25,19.5,Vol. 3 Earle Carver and Gilder Philadelphia,Note says it was conserved in 2003
9026,000,001,508341,,Ulysses S. Grant,Picture of Ulysses S. Grant,,,,FALSE,17.75,15,,Broken into 6 pieces
9026,000,001,482508,12/31/1976,Non-Interest Revolutionary War Bond,"A replica of a war bond for Dover, for the Bicentennial",,,,FALSE,11.5,15.24,,Good
9026,000,001,482508,1976,Light Infantry Co. of Dover,"A replica of a Declaration of Commission (2 Copies), for the Bicentennial",,,,FALSE,15.5,13.5,,Good
9026,000,001,482508,,The Institution of the Society of the Cincinnati,A replica of the original document,,,,FALSE,18.5,18,,Good
9026,000,001,482508,1926,The Sesqui Centennial International Exposition,Certificate of recognition for Delaware's participation in the exposition,,,,FALSE,21,27,"E. A. Wright Co, Philadelphia",Good
9026,000,001,482508,,In Congress,"Replica of the Declaration of Independence, small history on the bottom",,,,FALSE,24,19,,Good
9026,000,001,482508,,In Congress,Replica of the Declaration of Independence,,,,FALSE,29.5,24.5,,Poor and on a heavy board
9026,000,001,508348,,"A Newsboys' Picnic, Wilmington, Delaware",A series of illustrations with captions depicting days' events.  Racist caricatures of blacks,,,,FALSE,7.75,11,,Some damage to edges
9026,000,001,508348,1876,"Delaware Building, Centennial International Exhibition",Picture of the Delaware Building featured in the Centennial International Exhibition in Philadelphia,,,,TRUE,7,9,"Tho Hunter, Lith. 716 Filbert St. Philadelphia","Fair, some mild discoloration"
9026,000,001,508348,,The American Holly - State Tree of Delaware,A Promotional package for additional prints that has illustrated picture of the State Tree,,,,TRUE,11.5,7,"The Mercantile Press, Inc.",Good
9026,000,001,508348,,"Hon. John Minor Botts, M. C. from VA",Engraved for the American Review,,,,FALSE,8.5,5.25,,"Some discoloration, torn on right side"
9026,000,001,508348,,"In the hope of immortality ,A. Campbell",Portrait of older gentleman,,,,FALSE,10.75,6.75,,"Fair, on mat"
9026,000,001,508348,,George W. Childs,Portrait of George W . Childs form the left side,,,,FALSE,10,6.5,"Suddards and Fennemors, Philadelphia, PA",Damage on right side from being taken from a book
9026,000,001,508348,,"Commencement Day, Yale College, July 26, 1860.  Rev. Jeremiah Day - Rev Theodore D. Woosley Prof. Benj Silliman",Picture of the three men seated together,,,,FALSE,6,9.5,On steel by John Sartain Philadelphia after Ambrotypes by Wells for the Electric,Fair
9026,000,001,508348,,"Robley Dunglison, M. D.",Professor of Institutes of Medicine in the Jefferson Medical College of Philadelphia,,,,FALSE,7.25,4.5,Engraved by A. H. Ritchie from a Daguerreotype by M. P. Simons,Fair
9026,000,001,508348,,"Hon Geo Evans, U. S. Senator from Maine",Engraved for the American Review,,,,FALSE,8.5,5.25,Powell,"Discoloration, damage to right side from being torn from a book"
9026,000,001,508348,,Franklin,"Portrait of Benjamin Franklin, scene entitled ""Declaration of Independence"" beneath portrait",,,,FALSE,9.5,6.75,J A Duplessis and W J Edwards,"Torn from book, some damage to left side"
9026,000,001,508348,,General U. S. Grant,Portrait in Military Dress,,,,FALSE,11,8.5,,Some small Tears
9026,000,001,508348,,His Excellency S. Huntingdon,President of Congress,Profile of left side,,,FALSE,5.25,4.25,,Wrinkled from being poorly placed on mat
9026,000,001,508348,1916,Andrew Jackson,"Portrait, facing left",,,,FALSE,8.5,5.5,,Good apparently cut out from a calendar
9026,000,001,508348,,"Andrew Jackson, Daniel Webster, Henry Clay",Picture of the three men sitting next to each other,,,,FALSE,6.5,9.5,John Sartain Philadelphia,Some damage to edges
9026,000,001,508348,1871,The Last of the Queves,"Portrait of Daniel Jano Esq of Cincinnati, Ohio",,,,FALSE,9.75,6.5,,Appears to be a book cover
9026,000,001,508348,1861,Thomas Macdonough,Oirtrautm seated in chair wearing military dress,,,,TRUE,11,8.5,Johnson Fry and Co Publishers New York,Damage from book glue and tape
9026,000,001,508348,,"Willie P. Mangum, U. S. Senator from North Carolina",Engraved by T. Doney for the American Review,,,,FALSE,9,5.25,Anthony Clark and Co,Right side torn when taken from book
9026,000,001,508348,,"""Mr. Micawber"" from ""David Copperfield""",After a painting by Frank Reynolds,,,,TRUE,9,6.25,Hodder and Stoughton,Tears from being taken from a book
9026,000,001,508348,12/02/1827,"Henry M. Ridgley, U. S. Senate, Washington City",Portrait in profile,,,,FALSE,10.5,6.75,G. Bather and Son Brooklyn NY,Discoloration and a small hole
9026,000,001,508348,,Thomas Samuel Stewart,,,,,FALSE,7.75,4.5,,"Poor, torn edges, damage from folding, discoloration"
9026,000,001,508348,1728,Marten Harpertsz,"Portrait, caption in Dutch, Ridder Lt Admiral Van olland en Westvries land",,,,FALSE,12.5,8.75,,Looks like torn from book
9026,000,001,508348,,George Washington,"Bust o George Washington, similar to U.S. quarter coin",,,,FALSE,8.5,7.25,,"Good, edges poorly cut"
9026,000,001,508350,1968,"Center Meeting, Centerville","Picture of the Center meeting house, a Quaker building from a Delaware Trust Company calendar",,,,FALSE,13,10,,Good
9026,000,001,508350,,"Prince George's Church, Dagsboro, Delaware, Built A. D. 1730","Picture of Prince George's church form the right, 2 copies, includes informational sheet",,,,FALSE,9.5,12.5,,Good
9026,000,001,508350,1974,Prince George Church,Prince George's Church (2 Copies) by Florio,,,,FALSE,15.5,10,,Good
9026,000,001,508350,c 1910,Delaware City,Picture of Delaware City C 1910,,,,TRUE,16,28,"U. S. Army Corps of Engineers, Philadelphia District",Good
9026,000,001,508350,1953,"Delaware State Archives, Hall of Records, Dover Delaware",Picture of the Hall of Records by H T MacNeill,,,,FALSE,11,14.5,,Some pencil markings and damage from framing tape
9026,000,001,508350,1956,For Mr. de Valenger (Hand written),"Picture of John Dickinson Mansion by H T MacNeill, labeled with ""#2""",,,,FALSE,11,14.5,,Some markings and damage to corners
9026,000,001,508350,1956,1740 Original House (Hand written),"Picture of John Dickinson Mansion by H T MacNeill, labeled with ""#3""",,,,FALSE,11,14.5,,Some markings and torn upper corner
9026,000,001,508350,1956,,"Picture of John Dickinson Mansion by H T MacNeill, labeled with ""#4""",,,,FALSE,11,14.5,,Some markings and corners damaged from acidic tape
9026,000,001,508350,1909,,Architect's water color rendering of proposed plan for restoration of the Old State House and Supreme Court,,,,TRUE,10.5,12.5,,"On damaged mat, watercolor severely faded"
9026,000,001,508350,1965,,Picture of Old State house and Supreme Court by Florio,,,,FALSE,12,19.5,,Good
9026,000,001,508350,10/1979,Season's Greetings,Picture of Old State House and Supreme Court in the Snow,,,,TRUE,17,22,,Some tears and markings
9026,000,001,508350,11/1981,Season's Greetings,Picture of City Hall in Dover in the Snow,,,,TRUE,17,22,Dover Litho Printing Co,Good
9026,000,001,508350,11/1982,Season's Greetings,Picture of Legislative in Dover in the Snow,,,,TRUE,16.5,22,Dover Litho Printing Co,Good
9026,000,001,508350,1930,,"""Kingston-Upon Hull"" House from the front at a distance, description on back of mat",,,,FALSE,17,15,,On acidic mat but otherwise good
9026,000,001,508350,1/23/1945,"Proposed Seaman's Memorial Lewes, Delaware",Shows three views on the proposed memorial,,,,TRUE,30,22,,Good
9026,000,001,508350,1730-1735,"Parson Thorne Mansion, Milford, Delaware 1730-1735",Picture of a mansion from the front right at a distance,,,,FALSE,11.25,15,,Good
9026,000,001,508350,10/15/1952,"Old Court House, New Castle Delaware","As shown in Latrobes' Survey, dated 1804",,,,FALSE,17,23,,Some wrinkles from folding
9026,000,001,508350,1967,1670 This is New Castle Delaware 1870,Shows historic buildings in New Castle with their names and dates (2 Copies),,,,TRUE,16,21,,Good
9026,000,001,508350,,,Picture of the Old Court House in New Castle,,,,FALSE,16,20,,Good
9026,000,001,508350,03/17/1962,The Saturday Evening Post,Cover of Magazine features Delaware Street in New Castle (3 Copies),,,,TRUE,13.5,10.5,,Fair
9026,000,001,508350,1951,New Castle During the Dutch Regime,"Picture of Old New Castle from above, large ship in river (9 Copies)",,,,FALSE,10,16,"Drawn by John B Mall, Jr.",Excellent
9026,000,001,508350,,,Picture of the Tile House,,,,TRUE,18.5,15,,"On acidic mat that has damaged work, watercolor faded"
9026,000,001,508343,1750's,,Print of Mahoe/Wallace Farm in the 1750's (2 Copies),,,,TRUE,11,17,,Excellent
9026,000,001,508350,1968,Belmont Hall,View of Belmont Hall from front from calendar of Delaware Trust Company,,,,FALSE,13,10,C. L. Story Co,Good
9026,000,001,508350,1964,Allee House,Picture of Allee House and grounds (6 Copies),,,,FALSE,14.5,20,,Good
9026,000,001,508350,1968,St. George's Chapel (Episcopal),"View of the Church, on a calendar for Delaware Trust Company",,,,FALSE,13,10,,Good
9026,000,001,508350,,,Silhouette of Brandywine Village School by Henry Law,,,,FALSE,16.5,12,,Mat has spotting
9026,000,001,508350,,,Silhouette of Old Swede's Church by Henry Law,,,,FALSE,16.5,12,,Mat has lots of spotting
9026,000,001,508350,,,Silhouette of Old Town Hall by Henry Law,,,,FALSE,16.5,12,,Mat has lots of spotting
9026,000,001,508350,,Representation of the Gas Works Wilmington Delaware,"A Newspaper print that has been colored by hand, shows works from across the river",,,,TRUE,7,11,,Some discoloration and fraying on edges
9026,000,001,508350,,Old Swede's Church,View of the front of the Church,,,,FALSE,11,8.5,,Good
9026,000,001,508350,,"Old Swede's Landmark Wilmington, Delaware",View of the two story building from the street,,,,FALSE,12.5,10,,"The John M. Rogers Press, Wilmington, Delaware"
9026,000,001,508350,,"Old Swede's Church Wilmington, Delaware",A view  of the Church from  a distance,,,,FALSE,12.5,10,"The John M Rogers Press, Wilmington Delaware",Lots of discoloration
