RG,SG,Series,Barcode,Date,Caption,General Description,Item,Ordered By,Owber,Colored,Height,Width,Pub/Printer,Condition
1325,000,231,508332,01/26/1882,"Executor's Sale of Valuable Real Estate, Horses and mules","Gives a list of livestock and crops to be sold, carnages, farming implements","Livestock, crops, etc.",Executors of Samuel Townsend's estate,"Samuel Townsend, Dec'd",FALSE,26,19.5,,"Marks from other broadsides, damage to top right corner"
1325,000,231,508332,08/24/1961,Executor's Sale of Valuable Real Estate,Descriptions of four pieces of land and terms of sale,Land,Farmer's Bank,"Ida S. McGongal, Dec'd",FALSE,28,18,,"Some markings, hole from posting"
1325,000,231,508332,12/15/1877,Sheriff's Sale,Tracts of land situated in Kenton Hundred,Land,"Benjamin F. Blackiston, Sheriff",Henry and Amey Hudson,FALSE,13.5,14,Delawarean Cheap Book & Job Printing Office,"Writing in pencil, damaged by folding"
1325,000,231,508332,02/27/1878,Sheriff's Sale by Virtue of Two Writs of Verditroni Exponas,"One hundred and thirty four acres, two story frame dwelling - house",land and house,"Benjamin F. Blackiston, Sheriff","John Savin, John Griffin, John Rice",FALSE,10.5,14,Delawarean Cheap Book & Job Printing Office,Edges damaged
1325,000,231,508332,12/21/1878,Sheriff's Sale by Virtue of a Writ of Levari Facias,Situated on Commerce Street,,"Benjamin F. Blackiston, Late Sheriff",Joseph e. Worden,FALSE,10.5,14,Delawarean Cheap Book & Job Printing Office,"Large chunk missing from top center, damage from folding"
1325,000,231,508332,01/07/1879,Sheriff's Sale by Virtue of a Writ of Venditioni Exponas,"About one acre of ground, more or less, with no improvements",Land,"Benjamin F. Blackiston, Late Sheriff",Asa S. Clifton,FALSE,10,14,Delawarean Cheap Book & Job Printing Office,Some damage from Folding
1325,000,231,508332,01/07/1879,Sheriff's Sale by Virtue of a Writ of Levari Facias,Five thousand square feet of land with two-story dwelling house with back buildings,Land and Dwelling,"Benjamin F. Blackiston, Late Sheriff",George and Rachel Whitlock,FALSE,10.5,14,Delawarean Cheap Book & Job Printing Office,Lots of damage from folding
1325,000,231,508332,01/11/1879,Sheriff's Sale,"93 acres, one story frame dwelling, carriage house, stables, and small peach orchard",land and buildings,"Benjamin F. Blackiston, Late Sheriff",Mary E. Thompson,FALSE,10,14,Delawarean Cheap Book & Job Printing Office,Damage to edges
1325,000,231,508332,11/19/1891,Sheriff's Sale by Virtue of a Writ of Venditioni Exponas,"Land, one and half story dwelling house and other out buildings, peach orchard",Land and dwellings,"Amos Cole, Sheriff",Joshua E. Short,FALSE,10,13,,"Good, light fold lines"
1325,000,231,508332,11/28/1866,Sheriff's Sale by Virtue of a Writ of Venditioni Exponas,four tracts of land,Land,"S. M. Collins, Sheriff","Rodney Fisher, Dec'd",FALSE,12,13.5,,Mold damage and folding damage
1325,000,231,508332,09/17/1877,Sheriff's Sale,475 acre plantation,Land,"Benjamin F. Blackiston, Sheriff",Enoch and Mary Spruance,FALSE,10.5,14,Delawarean Cheap Book and Job Printing Office,Large tear at top from posting
1325,000,231,508332,03/24/1933,Sheriff's Sale! Of Valuable Real Estate,by virtue of a writ Fi. Fa. At.,Land,"Robert A. Saulsbury, Sheriff",Jennie J. David,FALSE,19,12,"The Capital Printing Co. Dover, DE","Large tear bottom left, damage to edges"
1325,000,231,508332,11/16/1939,Sheriff's Sale! Of Valuable Real Estate,2 pieces of land with their improvements,Land and buildings,"Grier H. Minner, Sheriff",Robert J. Seward,FALSE,19,12.5,,"Good, small hole from posting"
1325,000,231,508332,11/17/1939,Sheriff's Sale! Of Valuable Real Estate,180 acres of land,Land,"Grier H. Minner, Sheriff",William and Rose Robinson,FALSE,19,12,,"Good, small hole from posting"
1325,000,231,508332,11/13/1939,Sheriff's Sale! Of Valuable Real Estate,180 acres of land,Land,"Grier H. Minner, Sheriff",William and Rose Robinson,FALSE,19,12,,"Good, small hole from posting"
1325,000,231,508332,09/05/1939,Sheriff's Sale! Of Valuable Real Estate,A parcel of land and a large concrete block building used as a church,Land and Church,"Grier H. Minner, Sheriff",Union Baptist Church,FALSE,19,12.5,,Some discoloration and hole from posting
1325,000,231,508332,07/29/1940,Sheriff's Sale! Of Valuable Real Estate,"Parcel of land with two story frame dwelling house, large barn and other out buildings",Land and buildings,"Grier H. Minner, Sheriff",Reese B. Jones,FALSE,19,12.5,,"Good, hole from posting"
1325,000,231,508326,1963,The Watson House,Give history of the house. Appears to be an advertisement for Paul J. Nowland and Co.,,,,FALSE,14,8.5,,Some bent corners
1325,000,231,508326,09/07/1908,Labor Day Fair,"For the benefit of the ""Palmer Home"" to be held at Wildcat Manor, ""Come and Bring Your Money""",,,,FALSE,26,19.5,,Some tears along folding lines
1325,000,231,508326,04/01/1878,Office of The Casho Machine Co,Price list of Powers and Machines for 1878,Engines for wagons,,,FALSE,8,5.25,,"Good, some writing on bottom"
1325,000,231,508326,,Wm. G. Philips and Bro.,"List of Prices f Bent Fellowes, turned spokes, etc.",Felloes and Handes,,,FALSE,9,8,,"Damaged edges, written on"
1325,000,231,508326,01/03/1871,Improved Stepladder,"Wm G Phillips has a new, reliable invention, is described and has information on purchase rights",Stepladder,,,FALSE,10,8,,"Damage to edges, discoloration"
1325,000,231,508326,09/28/1871,Now is Your Time to Make Money,Subscriber has returned with a large stock of fall and winter goods usually in first class stores,"Clothes, groceries, hardware",,,TRUE,11.5,6,"Delaware Print, Dover",Torn at bottom
1325,000,231,508326,C 1955,Historic Delaware Home for Sale,"Woodlawn, a 22 room mansion, is for sale, gives brief history and description, 2 copies",Home,,,FALSE,14,8,,Good
1325,000,231,508326,,For Sale,"By Joseph Bringhurst, list of items for sale at his market, many vegetables, fruits and more",Produce and spices,,,FALSE,4.5,3,"Bonfal and Niles, Market Street Wilmington","Fair, in Mylar"
1325,000,231,508326,03/17/1892,"Don't Fail to See The Comedy Drama, Joshua Whitcomb",Gives cast and characters and synopsis,,,,FALSE,10.5,5.5,State Sentinel Print,Some edges torn
1325,000,231,508326,,"Thomas Knott, Dealer in Fruits and Vegetables",Ad for fresh groceries,,,,FALSE,9.25,5.75,"James Printing Rooms, 224 Market Street Wilmington","Discolored, tearing from posting"
1325,000,231,508326,c 1948,"The Lady, A Native Devon Cow","7 years old, belonging to C. P. Holcomb",Cow,Eliza Morrison,C. P. Holcomb,FALSE,10.75,8.5,,Good
1325,000,231,508329,01/02/1807,"United States of America Commonwealth of Massachusetts, Interrogatories","Examination of William Mills regarding the building of a Draw-Bridge, John Hancock is a subscriber for reputation of Mills",,,,FALSE,12.5,15.5,,"Fari, some Ink damage"
1325,000,231,508328,06/30/1864,The Fall of Empires,"Delivered at the Commencement of Georgetown College, by a student from Delaware",,,,FALSE,18,7.5,,"Yellowed, folding damage"
1325,000,231,508328,,University of Delaware Dormitory House Rules,"Notice to students of rules for living in dormitory, allows use of Victoria's",,,,FALSE,11,8.5,,Good
1325,000,231,508329,1865,Order! In view of the terrible calamity which has befallen Country by the Assassination of President Lincoln,A request for citizens to abstain from disorderly assemblies o breaching the peace,,,,FALSE,18,12.5,,Ink damage
1325,000,231,508329,03/05/1828,An ordinance to out home the borrowing a sum of money not exceeding twelve thousand dollars,Approval to borrow money for the purpose of distributing the Brandywine water in Wilmington,,,,FALSE,9,10,office of the Delaware Patriot,"Water damage, frayed edges"
1325,000,231,508329,04/07/1827,"An ordinance for the regulation of the owners, riders and drivers, of Carnages, wagons, carts, Drays and Horses within the Borough of Wilmington","Drivers must stay on right side of street, no racing, no horses at large in street",,,,FALSE,13,8,"A. and H. Wilson, Printers",Some ink damage and frayed edges
1325,000,231,508329,09/10/1805,"By the Corporation of the Borough of Wilmington, A Proclamation",Orders that no vessels are allowed to come to Wilmington from New York due to an out break of disease.,,,,FALSE,13,8.5,H. Niles,Damaged edges and discoloration
1325,000,231,508329,01/01/1855,"Address of the Camers of the ""statesman and Blue Hen's Chicken""",Lyrics to the song with decorative border,,,,FALSE,19,12,Fancy Job Printing,"Very poor, lots of chunks missing around edges and damage from folding"
1325,000,231,508329,,To the Honorable the Legislature of the State of Delaware,A petition from the citizens of New Castle County regarding moving the Seat of Justice for more central and secure location,,,,FALSE,13,8.25,,Damaged edges
1325,000,231,508329,03/25/1895,An Act Prohibiting Livestock from Running at Large in School Districts,"for School districts 20 and 20 1/2, act saying where livestock cannot wander and rules for violators",,,,FALSE,11,5.25,"Henry Eckel, Printer, Vournal Building, 510 Market St.","Fair, some tears"
1325,000,231,508329,11/14/1862,Delaware State Lottery,"Lottery for Internal Improvements in Delaware Sponsored by John A. Morris and Co, Managers (Original Copy)",,,,FALSE,21,6,,Good Except for blue ink smears
1325,000,231,508329,1954,Legal Holidays in the United States,"Lists most National and State Holidays, includes letter to printer from Delaware State Archivist noting omission of some holidays",,,,TRUE,22,17,,"Good, damage from folding"
1325,000,231,508329,10/22/1927,Some Reasons for Navy Day,A reprinted article by P. F. Harrington,,,,FALSE,12,7.5,,Some minor tears
1325,000,231,508329,06/01/1950,New Castle Tercentenary of Dutch Settlement 1651-1951,"Information on the Dutch Settlers, on the Commission, and Celebration (2 Copies)",,,,FALSE,10,6.5,,Good
1325,000,231,508329,10/31/1950,New Castle Tercentenary of Dutch Settlement 1651-1951,Brief history of the Dutch Settlers (2 Copies),,,,FALSE,11,8.5,,Good
1325,000,231,508329,09/09/1969,Public Meeting on Master Plan for Killen's Pond,Meeting on the proposed development plan for the recreational facilities at State Park,,,,FALSE,11,8.5,,Good
1325,000,231,508329,09/11/1847,$4000! Lottery for the Benefit of Sussex County,Gives break down of prizes and ticket combinations,,,,FALSE,10.75,5,,Wrinkled
1325,000,231,508329,06/29/1860,"Wood, Eddy and Co's Lotteries!",Lottery for the benefit of the State of Delaware,,,,FALSE,14,8.5,Lewisson and Co,
1325,000,231,508329,11/10/1925,The Colors of the American Flag,Written by retired Admiral P. F. Harrington,,,,FALSE,9,5.5,,Edges deteriorating
1325,000,231,508329,c 1954,A Message of Importance to the Taxpayers of the City of Dover,Vote for approval of bonds for improvements to the city,,,,FALSE,24,18,,Some damage from folding
1325,000,231,508329,1880,List of Colored Persons Convicted of Felony from 1866 - 1880,Approximately 157 names listed,,,,FALSE,10.5,8,,"Folding damage, written on"
1325,000,231,508329,06/30/1824,"Rangers, Fence Viewers",List of Rangers and Fence Views in the Hundreds of New Castle County,,,,FALSE,13.25,8,Robert Porter,Good
1325,000,231,508329,01/27/1835,Causes for Trial and Argument,"List of cases being presented to the Honorable Kensey Johns Jr., Chancellor",,,,FALSE,8.25,13,,Good
1325,000,231,508329,10/17/1864,To The lawful Voters of Delaware,Proclamation from Governor Bramlette of Kentucky regarding Martial Law,,,,FALSE,12,6.5,,Good
1325,000,231,508330,c 1801,"I Abner Dill, at Milford",Witnesses discuss the religious opinions of candidates for Governor,,,,FALSE,9,8,,Good
1325,000,231,508330,,The Tables Turned! Where were you born!,A list of important Delaware Officials who were not born here,,,,FALSE,13,6,,Good
1325,000,231,508330,10/01/1804,To the People,"Considerable noise having been made about Democratic Republican candidate for Governor Joseph Haslett, relative to the sale of certain persons of color.",,,,FALSE,13,8,,Damage from folding and torn edges
1325,000,231,508330,05/18/1804,To the Patrons of the Republican Advocate,Payment of subscription to paper. Opinion on current state of the Press in society,,,,FALSE,12.5,7.5,,"Torn edges, water damage"
1325,000,231,508330,09/27/1808,To the Democratic Republicans of Christiana Hundred,The Committee's position on an embargo and the state of the party,,,,FALSE,20.5,8.5,,"Very poor, lots of tears"
1325,000,231,508330,09/29/1806,To the Electors of New Castle County,"An ""Independent Voter"" offers his objection to a bridge across the Christiana",,,,FALSE,19,15,,tears from folding
1325,000,231,508330,09/23/1802,Circular,Endorsing candidates for upcoming elections in Frederick County,,,,FALSE,16,10,,"Poor, discoloration, damage from folding"
1325,000,231,508330,,To the Republicans of Christiana Hundred,T. Perkins announces the names that will be placed on his ticket as delegates for the Christiana Hundred,,,,FALSE,7,8.5,,"Moisture damage, bad edges"
1325,000,231,508330,09/06/1806,At an Adjourned Meeting of the Amicable Conferees of New Castle County at Red-Lion Inn,Discussion of how to strengthen Republican Interest in New Castle County,,,,FALSE,10.5,8.5,"James Wilson, Market Street, Wilmington",Damages to edges
1325,000,231,508330,05/11/1816,"Delaware Republican, Extra, President's Message",Reprinting President James Polk's message to the Congress regarding the War Bill,,,,FALSE,23.5,12.5,,"Lot of damage to edges, and tears from folding"
1325,000,231,508330,06/23/1840,To the People of Christiana Hundred,"The undersigned committee of Democratic Republican Citizens gives general news, urges vote for Wm. Henry Harrison for President",,,,FALSE,22.5,12.5,,Damage from folding
1325,000,231,508330,02/06/1837,"Public Meeting, on Saturday the 11th",Meeting to re-asserted fixed determination regarding the question of where courts of justice will be located,,,,FALSE,16,10.5,,"Poor, lots of damage"
1325,000,231,508330,post civil war,To the White Men of Delaware,"Wants to warn fellow white men that the negro race is trying to take over Delaware signed by ""Clericus""",,,,FALSE,13.5,10,,"Very poor, large tears from folding"
1325,000,231,508330,01/19/1953,City Election,The Publicity Committee of the Citizens Group endorsing candidates for Council,,,,FALSE,11,8,,Good
1325,000,231,508330,10/1844,To the Public,Statements for Stephen and Theophilus A. Redden and John Hopkins denouncing William Tharp,,,,FALSE,12,9,,Lots of damage to edges
1325,000,231,508330,01/21/1952,City Election,Publicity Committee endorsements for Mayoral and Council Candidates,,,,FALSE,9.5,7,,Good except for one tear
1325,000,231,508330,07/24/1876,To The Democratic Voters of New Castle County,"Written by Samuel Townsend, accuses leading Democratics of self interest politics and denying votes to their own party members",,,,FALSE,9,6.75,,Good
1325,000,231,508330,10/14/1872,An Address to the Democracy of Delaware,To the Enemy's of Negro Equality in Delaware from Samuel Townsend,,,,FALSE,8,10,,Fair
1325,000,231,508330,,Delawareans Attend!,Propaganda for Congress candidate Nathaniel B. Smithers,,,,FALSE,11,8.5,,
1325,000,231,508330,11/20/1831,To the Public,Reasons why Charles C. Emory should be Sheriff,,,,FALSE,18,10.75,,"Very Poor, Sections Missing, Moisture Damage"
1325,000,231,508330,09/08/1868,A Few Lines to the Democrats of New Castle County,"By Samuel Townsend, particularly for those who are in favor of Nominations by Ballot",,,,FALSE,12,6.5,,Some dark Spots
1325,000,231,508330,10/20/1862,To the Douglas Democracy of Delaware,"By Samuel Townsend, on upcoming elections (2 Copies)",,,,FALSE,12,6.5,,Yellow Spotting
1325,000,231,508330,10/04/1856,To the Democracy of New Castle County,"By Samuel Townsend, and Central Committee of the Appoquinimink Hundred, voting at County Convention",,,,FALSE,13,8,,"Wrinkling, damaged on right side"
1325,000,231,508330,01/17/1953,City Election,List of Council Candidates endorsed by the Citizens Committee of Dover,,,,FALSE,11,8.5,,Some Dark Spots
1325,000,231,508330,08/29/1828,To the Young Men of Dover!,"Pro Andrew Jackson Propaganda from ""The Voice of 76""",,,,FALSE,9.75,7,,Good
1325,000,231,508330,09/02/1808,Pursuant to Public Notice Given,Meeting of Democratic Republicans creating 5 person committees for each district of town,,,,FALSE,8.75,7.75,,Good
1325,000,231,508330,10/06/1870,Independent Democratic County Meeting,Retrenchment and Reform! (2 copies),,,,FALSE,33,24,,"One copy very poor and in Mylar, the other is better but with folding and water marks"
1325,000,231,508331,1800,A Correct Statement of Facts,"Respecting a bank note, exchanged with Edward Worrell, by Caleb Kendall to an impartial public",,,,FALSE,13,16.25,,Poor
1325,000,231,508332,01/09/1801,Public Sale,"Personal Property, Land, Buildings, and Slaves","Slaves, property, buildings","Joseph Israel, Sheriff",Jesse Higgens,FALSE,13,8,,Good
1325,000,231,508332,c 1800,Notice  On -- the -- day of -- the Subscriber,This broadside contains two blank notices that would have been filled in by hand,,"James Sorden, Collector of Revenue for Kent County",,FALSE,13,8,"W. Black, Printer, Dover, DE","Torn Section bottom left, frayed edges"
1325,000,231,508332,12/05/1938,Constable's Sale,Sale of a Chevrolet Coach,1934 Chevrolet Coach,"Walter S. Cubbage, Constable",E. M. Wallace and William H. Wallace,FALSE,9.5,8.5,,Good
1325,000,231,508332,09/30/1824,Will Be Exposed to Sale,"2 story brick house and kitchen, land for sale",House and land,Orphan's Court,Joshua Wollaston,FALSE,7..5,9,Robert Porter,Good
1325,000,231,508332,12/02/1825,Mills for Rent,"To be let for one or more years, the Grist Merchant Mill and Saw Mill",,,,FALSE,8.75,10.5,,Good
1325,000,231,508332,05/1731,Advertisement,Land and dwelling house being sold along with various belongings,Land and dwelling house,"Thomas Gray, Executioner","John Henzey, Dec'd",FALSE,9.75,6.75,,Good
1325,000,231,508332,02/19/1867,Orphans' Court Sale of Valuable Real Estate,27 acres and 99 acres,2 tracts of land,"John M. Voshell, Mary A. Roberts, Admin.","James Roberts, Dec'd",FALSE,17.5,12,"Times Office, Smyrna",Tear at bottom center
1325,000,231,508332,07/29/1731,Advertisement,"260 acres of land, piece of Marsh, dwelling House, store houses, and some possessions",Building and land,"Thomkaas Gray, Executor","John Henzey, Dec'd",FALSE,8.5,6.5,,Good
1325,000,231,508334,1850's,Circular No. 2,"Written by Samuel Townsend, discusses temperance debate, churches role, biblical defense of liquor",,,,FALSE,10.5,8,,"Some folding, edges slightly torn"
1325,000,231,508335,06/23/1856,Railroad! Change of Time,"New Train schedule for New Castle and Wilmington, New Castle and Frenchtown",,,,FALSE,13,9.5,C. P. Johnson's Steam Power Press,
1325,000,231,508335,1957-1967,An Appeal to the Delaware General Assembly,"""Citizens for Freeways"" urge the Assembly to authorize funds to complete the Freeway Promptly",,,,FALSE,8.5,11,,Good
1325,000,231,508335,02/15/1950,"Bus Express, Dover - Smyrna - Middletown - Wilmington",List of train connections at Wilmington,,,,FALSE,11,8.5,,A few small tears
1325,000,231,508335,,The Deadly Railroad Pass,An article about evils of railroad read at Peninsula Horticultural Society (one original and one photocopy),,,,FALSE,12,10,,One small tear
1325,000,231,508335,05/28/1966,Wilmington and Western R.R.,Delaware's old time steam line scenic trips advertisement,,,,TRUE,14,5.5,,Tear on bottom and top from posting
1325,000,231,508335,07/01/1863,"Philadelphia, Wilmington, and Baltimore Rail Road Co",Market-Car Tariff. Lists locations and produce and coordinating tariffs.  (1 original and 1 photocopy),,,,FALSE,11,8.5,,Good
1325,000,231,508335,10/12/1874,To the Stockholders of the Delaware Rail Road Company,"Meeting scheduled to discuss terms with the Philadelphia, Wilmington, and Baltimore Rail Road Company (3 Copies)",,,,FALSE,12,18.5,,"Very Poor, all 3 in pieces"
1325,000,231,508336,11/27/1773,To the Delaware Pilots,From the Committee of Tarring and Feathering to Capt. Ayres,,,,FALSE,18.5,13,,Good
1325,000,231,508336,1861-1865,Delaware Republican Extra! List of Drafted Men,"List of drafted men from New Castle County, lists both white and colored men, says names were drawn by a young blind man",,,,FALSE,18.5,9,,"Poor, damage from folding"
1325,000,231,508336,ca. 1846,Wanted! More men for Army in Mexico,Recruiting Ad for more Delaware Troops,,,,FALSE,8.75,6,,Some damage at corners
1325,000,231,508336,12/24/1864,Notice!,"The President called for 300,000 men for army meeting to appoint committees to revise division enrollment lists",,,,FALSE,12.5,12.5,The Delawarean,Folding tears and water damage
1325,000,231,508336,c 1864,An Act to Relieve The People of This State from Draft,From House of Representatives,,,,FALSE,11.5,7.75,,Good
1325,000,231,508326,01/12/1849,Auction,Sale of Bed and Kitchen Furniture,Furniture,James Arnolds,,FALSE,4.5,8,,"Slightly frayed edges, writing on the back bleed through"
1325,000,231,508326,09/22/1852,The Twins,"These oxen - twins - look alike, is years and 9 months old, never sick, have won prizes",Oxen,Devondale Farm,,FALSE,9.25,9.25,,Good
1325,000,231,508329,,"To the Honorable, The Legislature of the State of Delaware","Petition of the undersigned citizens of New Castle County, requesting a move of the seat of Justice to a more convenient location",,,,FALSE,13.5,8,,Good
1325,000,231,508330,10/05/1853,Hazletville,"Meeting of Delaware citizens from Dover, Murderkill, Little Creek and Duck Creek Hundreds favorable to the Ratification of the Amended Constitution",,,,FALSE,9,10.5,,Good
1325,000,231,508330,06/25/1868,Criminal Reform,Discussion of the Delaware Association of Criminal Reform,,,,FALSE,12,9,,Good
1325,000,231,508330,,At an Adjourned meeting of the Amicable Conferences of New Castle,Descriptions of resolutions adopted,,,,FALSE,10.25,8.5,,Good
1325,000,231,508332,09/09/1731,Articles of this Vandue,Sale of about 260 acres,Land,"Thomas Gray, executor",,FALSE,11.75,7.5,,Good
1325,000,231,508332,04/10/1865,Register's Order,"All persons having a claim against David C. Wilson must present themselves to his executors by April 10, 1866",,,,FALSE,12.5,9,"C. P. Johnson's Steam Power Press, Wilmington",Good
1325,000,231,508335,06/23/1856,Railroad! Change of Time,"Delaware, New Castle and Wilmington and New Castle and Frenchtown Train Schedule",,,,FALSE,13,9,"C. P. Johnson's Steam Power Press, Wilmington",Good
7140,000,000,338845,03/25/1873,Public Meeting of Town Commissioners,Public meeting at the school to appoint a committee to examine the accounts,,,,FALSE,13.5,11,,"good condition, little acid damage"
9026,000,001,508339,,Peter Stuyvesant's Army Entering Amsterdam,"From a drawing by William Heath of London, satirical drawing of the march with narration under picture",,,,FALSE,10.5,28,Sarony and Major 117 Fulton Street New York,"Damage from folding, many tears"
9026,000,001,508339,,The Fighting Blue Hen,"Reproduction of painting by E. Paul Catts, shows Revolutionary War soldier with blue hens, legend on back of print (2 copies)",,,,TRUE,23.5,19,,Good
9026,000,001,508339,1927,"1797 - ""Old Ironsides"" U. S. Frigate Constitution 1927",Reproduction of painting by Gordon Grant,,,,TRUE,22.5,18.5,U. S. P. and L. Co,Good
9026,000,001,508339,1787,Be It Known James Tilton Esq.,Signed by George Washington certifying his service in the Army and membership in the Society of Cincinnati.  Original and mounted photostat copy.,,,,FALSE,16,22,,Damage on edges
9026,000,001,508339,,"Delaware Troops Leaving the Green, 1776","Reproduction of the mural in DPA research room, includes an artist/mural description (6 copies)",,,,TRUE,4,12,,Good
9026,000,001,508339,c 1974,1975 Annual Report Wilmington Trust,"Reproduction of an oil painting depicting a ""Delaware Blue"" in full uniform of the Delaware Regiment of General Washington's Continental Army",,,,TRUE,11,8.5,,Good
9026,000,001,508339,,Battle of Cowpens,Conflict between Colonels Washington and Tarleton,,,,TRUE,8,11,"Johnson, Fry and Co, Publishers, N. Y.",Good
9026,000,001,508339,,Capture of H. B. M. Sloop of War Frolic 22 Guns Captain Whinyates by the U. S. Sloop of War Wasp 18 Guns Captain Jones,Depicts 2 ships fighting in open water from War of 1812,,,,TRUE,15.25,19,W H Morgan 114 Chestnut Street Philadelphia,Good
9026,000,001,508339,1814,MacDonough's Victory on Lake Champlain,"MacDonough's Victory on Lance Champlain and defeat of the British Army at Plattsburg by General Macomb on September 11, 1814 from the War of 1812",,,,TRUE,20,26,H. Reineagle,Tear to right side
9026,000,001,508339,1898,"Soldier's Memorial, Spanish - American War of 1898","Company G, First Regiment Delaware, Volunteer Infantry, Includes illustrations",,,,FALSE,22,19,"A G Kuck and Co, 108 17th St. Buffalo, N. Y.","Torn on edges, large tear at middle"
9026,000,001,508339,1898,"Soldier's Memorial, Spanish - American War of 1898","Company D, First Regiment Delaware, Volunteer Infantry",,,,FALSE,22,19,"A G Kuck and Co, 108 17th St. Buffalo, N. Y.","Lots of damage, Barrows lamination"
9026,000,001,508339,1916,"Soldier's Memorial, on the Mexican Border, 1916","Men who answered the Nation's Call, Company F, First Delaware Infantry, National Guard, includes photo and illustrations",,,,FALSE,22,18,L. G. Fuller,Lots of spots from mold
9026,000,001,508339,1917,"Roll of Honor, Service in the World War","Roster of Company ""G"" First Delaware Infantry, Has Photographs",,,,TRUE,24,18,"H. N. Stratton; Chattanooga, Tenn.",Water damage
9026,000,001,508339,post 1953,A Tribute to Our War Dead,A list of Delawareans who died in WORLD War II and the Korean War are on a monument of the Delaware Memorial Bridge Plaza,,,,FALSE,25,15.5,,Good
9026,000,001,508339,1944,Scene in a Field,"WWII; Normandy, France; shows a platoon evidently caught by machine gun fire, all of whom appear killed or wounded",,,,FALSE,14,17.75,"62nd Engineer, top Co U. S. Army",Marks from framing tape
